park_name,park_code,states,designation,latitude,longitude,num_activities,num_topics,num_entrance_fees,description_length,has_camping,has_fishing,has_wildlife,has_biking,has_boating
Sequoia & Kings Canyon National Parks,seki,CA,National Parks,36.71277299,-118.587429,39,34,10,339,True,True,True,False,False
Shenandoah National Park,shen,VA,National Park,38.49236644,-78.46907715,34,26,10,349,True,True,True,True,False
Shiloh National Military Park,shil,"TN,MS",National Military Park,35.13850907,-88.3421072,20,25,0,366,False,False,True,True,False
Sitka National Historical Park,sitk,AK,National Historical Park,57.04718173,-135.3156876,16,30,0,358,False,True,True,False,False
Sleeping Bear Dunes National Lakeshore,slbe,MI,National Lakeshore,44.92844962,-86.02706591,29,23,5,398,True,True,True,True,False
Springfield 1908 Race Riot National Monument,spra,IL,National Monument,39.8027,-89.6422,0,9,0,377,False,False,False,False,False
Springfield Armory National Historic Site,spar,MA,National Historic Site,42.1086368,-72.57967415,8,41,0,400,False,False,False,False,False
Star-Spangled Banner National Historic Trail,stsp,"MD,VA,DC",National Historic Trail,39.2872505188,-76.6034317017,41,71,0,391,True,True,True,True,True
Statue Of Liberty National Monument,stli,NY,National Monument,40.6898,-74.0451,11,15,0,381,False,False,False,False,False
Ste. Geneviève National Historical Park,stge,MO,National Historical Park,37.9792171421,-90.0432157516,7,17,0,360,False,False,False,False,False
Steamtown National Historic Site,stea,PA,National Historic Site,41.40757521,-75.67037255,11,5,0,399,False,False,False,False,False
Stones River National Battlefield,stri,TN,National Battlefield,35.87608652,-86.43078399,23,22,0,251,False,True,True,True,False
Stonewall National Monument,ston,NY,National Monument,40.7337799072,-74.0006866455,3,6,0,243,False,False,False,False,False
Sunset Crater Volcano National Monument,sucr,AZ,National Monument,35.37114323,-111.510376,9,4,8,379,False,False,False,False,False
Tallgrass Prairie National Preserve,tapr,KS,National Preserve,38.44023613,-96.5670822,21,20,0,398,False,True,True,False,False
Thaddeus Kosciuszko National Memorial,thko,PA,National Memorial,39.94345312,-75.14732045,3,5,0,289,False,False,False,False,False
The White House and President's Park,whho,DC,,38.89541886,-77.03654147,9,29,0,381,False,False,False,False,False
Theodore Roosevelt Birthplace National Historic Site,thrb,NY,National Historic Site,40.7386469,-73.98903703,2,0,0,366,False,False,False,False,False
Theodore Roosevelt Inaugural National Historic Site,thri,NY,National Historic Site,42.90146781,-78.87248411,10,15,1,386,False,False,False,False,False
Theodore Roosevelt Island,this,DC,,38.89584162,-77.06241918,8,9,0,395,False,False,True,False,False
Theodore Roosevelt National Park,thro,ND,National Park,47.17777274,-103.4300083,28,29,6,391,True,False,True,True,False
Thomas Cole National Historic Site,thco,NY,National Historic Site,42.22570607,-73.86154864,6,0,0,391,False,False,True,False,False
Thomas Edison National Historical Park,edis,NJ,National Historical Park,40.78549896,-74.23821139,3,10,2,382,False,False,False,False,False
Thomas Jefferson Memorial,thje,DC,,38.88101431,-77.03632572,3,3,0,96,False,False,False,False,False
Thomas Stone National Historic Site,thst,MD,National Historic Site,38.52934443,-77.037813,6,21,0,217,False,False,True,False,False
Timpanogos Cave National Monument,tica,UT,National Monument,40.44039719,-111.7093944,4,9,3,395,False,False,False,False,False
Timucuan Ecological & Historic Preserve,timu,FL,Ecological & Historic Preserve,30.47251894,-81.49950104,26,20,0,260,False,True,True,True,True
Tonto National Monument,tont,AZ,National Monument,33.64842945,-111.1135627,12,6,2,384,False,False,False,True,False
Touro Synagogue National Historic Site,tosy,RI,National Historic Site,41.4893,-71.3121,3,3,0,385,False,False,False,False,False
Trail Of Tears National Historic Trail,trte,"AL,AR,GA,IL,KY,MO,NC,OK,TN",National Historic Trail,36.0530021046,-89.6761041963,8,18,0,243,False,False,False,False,False
Tule Lake National Monument,tule,CA,National Monument,41.88727902,-121.3744818,6,5,0,348,False,False,False,False,False
Tule Springs Fossil Beds National Monument,tusk,NV,National Monument,36.3893217,-115.3202223,14,23,0,206,False,False,True,True,False
Tumacácori National Historical Park,tuma,AZ,National Historical Park,31.567824,-111.051223,21,26,2,389,False,False,True,False,False
Tupelo National Battlefield,tupe,MS,National Battlefield,34.25557705,-88.73708623,2,6,0,369,False,False,False,False,False
Tuskegee Airmen National Historic Site,tuai,AL,National Historic Site,32.45538671,-85.67983321,4,6,0,375,False,False,False,False,False
Tuskegee Institute National Historic Site,tuin,AL,National Historic Site,32.42962115,-85.70488498,3,4,0,393,False,False,False,False,False
Tuzigoot National Monument,tuzi,AZ,National Monument,34.77296377,-112.0279069,9,15,1,362,False,False,True,False,False
Ulysses S Grant National Historic Site,ulsg,MO,National Historic Site,38.55182374,-90.35169255,16,20,0,309,False,False,True,True,False
Upper Delaware Scenic & Recreational River,upde,"NY,PA",Scenic & Recreational River,41.66172578,-75.03861562,20,28,0,400,True,True,True,False,True
Valles Caldera National Preserve,vall,NM,National Preserve,35.91682872,-106.5195724,30,47,3,344,False,True,True,True,False
Valley Forge National Historical Park,vafo,PA,National Historical Park,40.10054985,-75.44581889,20,21,0,386,False,True,True,True,False
Vanderbilt Mansion National Historic Site,vama,NY,National Historic Site,41.79697937,-73.94205557,10,2,1,195,False,False,False,False,False
Vicksburg National Military Park,vick,"MS,LA",National Military Park,32.3621286,-90.85030186,17,7,8,393,False,False,False,True,False
Vietnam Veterans Memorial,vive,DC,,38.89096297,-77.04765735,3,2,0,203,False,False,False,False,False
Virgin Islands Coral Reef National Monument,vicr,VI,National Monument,18.28996918,-64.70683395,15,14,0,267,False,True,True,False,True
Virgin Islands National Park,viis,VI,National Park,18.34279656,-64.74194451,31,22,0,399,True,True,True,False,True
Voyageurs National Park,voya,MN,National Park,48.48370609,-92.8382913,48,37,0,378,True,True,True,True,True
Waco Mammoth National Monument,waco,TX,National Monument,31.60465887,-97.17606143,2,1,0,271,False,False,False,False,False
Walnut Canyon National Monument,waca,AZ,National Monument,35.16822994,-111.5024239,8,6,8,289,False,False,False,False,False
War In The Pacific National Historical Park,wapa,GU,National Historical Park,13.43795691,144.6922461,8,10,0,293,False,False,False,False,False
Washington Monument,wamo,DC,,38.88948,-77.035207,5,4,1,126,False,False,False,False,False
Washington-Rochambeau Revolutionary Route National Historic Trail,waro,"MA,RI,CT,NY,NJ,PA,DE,MD,VA,DC",National Historic Trail,40.0958204557,-74.8563515109,0,10,0,208,False,False,False,False,False
Washita Battlefield National Historic Site,waba,OK,National Historic Site,35.62083963,-99.70445143,14,17,0,346,False,False,False,False,False
Weir Farm National Historical Park,wefa,CT,National Historical Park,41.25886268,-73.45452542,8,8,0,398,False,False,False,False,False
Whiskeytown National Recreation Area,whis,CA,National Recreation Area,40.61359941,-122.6022657,44,31,3,301,True,True,True,True,True
White Sands National Park,whsa,NM,National Park,32.77907858,-106.3333461,11,8,6,385,True,False,False,True,False
Whitman Mission National Historic Site,whmi,WA,National Historic Site,46.04119286,-118.4629388,15,11,0,379,False,False,True,False,False
William Howard Taft National Historic Site,wiho,OH,National Historic Site,39.11970352,-84.50758951,7,2,0,377,False,False,False,False,False
Wilson's Creek National Battlefield,wicr,MO,National Battlefield,37.1000127,-93.40986704,27,31,0,380,False,False,True,True,False
Wind Cave National Park,wica,SD,National Park,43.58012365,-103.4394709,25,28,0,379,True,False,True,True,False
Wing Luke Museum Affiliated Area,wing,WA,Affiliated Area,47.59820859,-122.3228912,6,3,0,394,False,False,False,False,False
Wolf Trap National Park for the Performing Arts,wotr,VA,,38.93854526,-77.265089,8,3,0,383,False,False,False,False,False
Women's Rights National Historical Park,wori,NY,National Historical Park,42.90817073,-76.81655558,6,22,0,399,False,False,False,False,False
World War I Memorial,wwim,DC,,38.8959,-77.0329,2,13,0,142,False,False,False,False,False
World War II Memorial,wwii,DC,,38.88923917,-77.0403759,3,6,0,230,False,False,False,False,False
Wrangell - St Elias National Park & Preserve,wrst,AK,National Park & Preserve,61.4182147,-142.6028439,42,34,0,396,True,True,True,True,True
Wright Brothers National Memorial,wrbr,NC,National Memorial,36.01637713,-75.66997163,5,6,6,393,False,False,False,False,False
Wupatki National Monument,wupa,AZ,National Monument,35.55741077,-111.3957216,19,7,9,400,False,False,True,True,False
Yellowstone National Park,yell,"ID,MT,WY",National Park,44.59824417,-110.5471695,53,62,10,206,True,True,True,True,True
Yorktown Battlefield Part of Colonial National Historical Park,york,VA,Part of Colonial National Historical Park,37.2195,-76.4983,21,28,1,392,False,False,True,True,False
Yosemite National Park,yose,CA,National Park,37.84883288,-119.5571873,33,43,9,399,True,True,True,True,True
Yucca House National Monument,yuho,CO,National Monument,37.24778944,-108.6861274,2,3,0,376,False,False,False,False,False
Yukon - Charley Rivers National Preserve,yuch,AK,National Preserve,65.0935608,-142.7960021,21,25,0,397,True,True,True,False,True
Zion National Park,zion,UT,National Park,37.29839254,-113.0265138,22,29,10,379,True,False,True,True,False
