park_name,park_code,states,designation,latitude,longitude,num_activities,num_topics,num_entrance_fees,description_length,has_camping,has_fishing,has_wildlife,has_biking,has_boating
Great Sand Dunes National Park & Preserve,grsa,CO,National Park & Preserve,37.79256812,-105.5919572,56,58,8,329,True,True,True,True,False
Great Smoky Mountains National Park,grsm,"NC,TN",National Park,35.60116374,-83.50818326,36,0,0,363,True,True,True,True,False
Green Springs,grsp,VA,,38.037099,-78.189823,3,8,0,394,False,False,False,True,False
Greenbelt Park,gree,MD,Park,38.98328267,-76.89722133,9,4,0,102,True,False,True,False,False
Guadalupe Mountains National Park,gumo,TX,National Park,31.92304462,-104.885527,20,20,2,382,True,False,True,False,False
Guilford Courthouse National Military Park,guco,NC,National Military Park,36.13225478,-79.8424561,14,15,0,352,False,False,False,True,False
Gulf Islands National Seashore,guis,"FL,MS",National Seashore,30.3211,-87.2304,44,38,3,210,True,True,True,True,True
Hagerman Fossil Beds National Monument,hafo,ID,National Monument,42.79074114,-114.9443074,14,7,0,366,False,False,True,False,False
Haleakalā National Park,hale,HI,National Park,20.70693015,-156.1591775,8,7,7,374,True,False,False,False,False
Hamilton Grange National Memorial,hagr,NY,National Memorial,40.81871605,-73.94878487,7,3,0,332,False,False,False,False,False
Hampton National Historic Site,hamp,MD,National Historic Site,39.4175296,-76.58781182,20,44,0,363,False,False,True,True,False
Harmony Hall,haha,MD,,38.74646351,-77.00377069,2,2,0,393,False,False,True,False,False
Harpers Ferry National Historical Park,hafe,"WV,VA,MD",National Historical Park,39.31865949,-77.74088546,6,20,3,363,False,False,False,False,False
Harriet Tubman National Historical Park,hart,NY,National Historical Park,42.9128920287,-76.5646715462,5,28,0,392,False,False,False,False,False
Harriet Tubman Underground Railroad National Historical Park,hatu,MD,National Historical Park,38.4548643511,-76.1373451376,6,13,0,393,False,False,False,False,False
Harry S Truman National Historic Site,hstr,MO,National Historic Site,38.92711967,-94.5162488,7,5,0,331,False,False,False,False,False
Hawaiʻi Volcanoes National Park,havo,HI,National Park,19.3355036,-155.4700257,17,12,6,364,True,False,True,True,False
Herbert Hoover National Historic Site,heho,IA,National Historic Site,41.66793558,-91.35232139,13,15,0,393,False,False,True,False,False
Historic Jamestowne Part of Colonial National Historical Park,jame,VA,Part of Colonial National Historical Park,37.2065,-76.7538,5,1,1,391,False,False,False,False,False
Home Of Franklin D Roosevelt National Historic Site,hofr,NY,National Historic Site,41.76639758,-73.92516857,6,1,2,389,False,False,False,False,False
Homestead National Historical Park,home,NE,National Historical Park,40.28802381,-96.83387781,15,23,0,397,False,False,True,False,False
Honouliuli National Historic Site,hono,HI,National Historic Site,21.38817536,-158.0574991,2,6,0,251,False,False,False,False,False
Hopewell Culture National Historical Park,hocu,OH,National Historical Park,39.31594374,-83.08049456,11,6,0,390,False,False,False,True,False
Hopewell Furnace National Historic Site,hofu,PA,National Historic Site,40.20610637,-75.76766355,30,52,0,352,False,False,True,True,False
Horseshoe Bend National Military Park,hobe,AL,National Military Park,32.97668879,-85.73413589,38,25,0,368,False,True,True,True,True
Hot Springs National Park,hosp,AR,National Park,34.52414366,-93.06332936,20,29,0,399,True,True,True,True,False
Hovenweep National Monument,hove,"CO,UT",National Monument,37.39134092,-109.0047977,8,4,3,340,True,False,False,False,False
Hubbell Trading Post National Historic Site,hutr,AZ,National Historic Site,35.70727324,-109.5599515,5,4,0,399,False,False,False,False,False
Ice Age Floods National Geologic Trail,iafl,"WA,OR,ID,MT",National Geologic Trail,46.5669309008,-118.992564971,4,3,0,389,False,False,False,False,False
Ice Age National Scenic Trail,iatr,WI,National Scenic Trail,43.9895697794,-89.5612021706,11,11,0,355,True,True,True,False,False
Independence National Historical Park,inde,PA,National Historical Park,39.94746112,-75.14794157,8,24,1,316,False,False,False,False,False
Indiana Dunes National Park,indu,IN,National Park,41.63765525,-87.09647445,35,12,7,399,True,True,True,True,True
Isle Royale National Park,isro,MI,National Park,48.01145819,-88.82780657,35,29,1,384,True,True,True,False,True
Iñupiat Heritage Center,inup,AK,,71.29832445,-156.7535863,2,1,0,395,False,False,False,False,False
James A Garfield National Historic Site,jaga,OH,National Historic Site,41.66486549,-81.35086557,7,6,0,395,False,False,False,False,False
Jean Lafitte National Historical Park and Preserve,jela,LA,National Historical Park and Preserve,29.81739855,-90.1402241,24,44,0,397,False,True,True,False,False
Jewel Cave National Monument,jeca,SD,National Monument,43.73102945,-103.829994,10,9,0,396,False,False,True,False,False
Jimmy Carter National Historical Park,jica,GA,National Historical Park,32.03611,-84.3924,8,5,0,305,False,False,False,True,False
John Day Fossil Beds National Monument,joda,OR,National Monument,44.62566508,-119.8811491,6,6,0,396,False,False,False,False,False
John Fitzgerald Kennedy National Historic Site,jofi,MA,National Historic Site,42.34693694,-71.12323846,6,6,0,369,False,False,False,False,False
John Muir National Historic Site,jomu,CA,National Historic Site,37.9828422,-122.1326097,7,7,0,391,False,False,True,False,False
Johnstown Flood National Memorial,jofl,PA,National Memorial,40.34584534,-78.77448601,5,20,0,377,False,False,False,False,False
Joshua Tree National Park,jotr,CA,National Park,33.91418525,-115.8398125,29,20,3,399,True,False,True,True,False
Juan Bautista de Anza National Historic Trail,juba,"AZ,CA",National Historic Trail,33.8743390994,-117.224179857,16,9,0,363,False,False,False,True,False
Kalaupapa National Historical Park,kala,HI,National Historical Park,21.1731108,-156.9511609,3,5,0,394,False,False,False,False,False
Kaloko-Honokōhau National Historical Park,kaho,HI,National Historical Park,19.68083237,-156.0306932,14,2,0,300,False,True,True,True,False
Katahdin Woods and Waters National Monument,kaww,ME,National Monument,45.9567565918,-68.7122879028,22,14,0,230,True,True,True,True,False
Katmai National Park & Preserve,katm,AK,National Park & Preserve,58.62235668,-155.0126574,23,35,0,386,True,True,True,False,True
Kenai Fjords National Park,kefj,AK,National Park,59.81804414,-150.106502,38,33,0,340,True,True,True,False,True
Kenilworth Park & Aquatic Gardens,keaq,DC,,38.9128,-76.9434,13,22,0,377,False,False,True,False,False
Kennesaw Mountain National Battlefield Park,kemo,GA,National Battlefield Park,33.95370717,-84.59214186,8,13,6,319,False,False,False,True,False
Keweenaw National Historical Park,kewe,MI,National Historical Park,47.1792308,-88.52275344,15,6,0,386,False,False,False,True,False
Kings Mountain National Military Park,kimo,SC,National Military Park,35.13900723,-81.38978712,5,6,0,349,False,False,False,False,False
Klondike Gold Rush - Seattle Unit National Historical Park,klse,WA,National Historical Park,47.5993663,-122.3319664,5,5,0,352,False,False,False,False,False
Klondike Gold Rush National Historical Park,klgo,AK,National Historical Park,59.61042373,-135.2618535,24,52,0,297,True,False,True,False,False
Knife River Indian Villages National Historic Site,knri,ND,National Historic Site,47.3540219,-101.3860533,23,15,0,277,False,True,True,False,False
Kobuk Valley National Park,kova,AK,National Park,67.35631336,-159.2002293,19,11,0,396,True,True,True,False,True
Korean War Veterans Memorial,kowa,DC,,38.88784226,-77.04773857,3,2,0,166,False,False,False,False,False
LBJ Memorial Grove on the Potomac,lyba,DC,,38.87858036,-77.05145832,9,8,0,399,False,False,True,True,False
Lake Clark National Park & Preserve,lacl,AK,National Park & Preserve,60.57405857,-153.55535,39,42,0,298,True,True,True,True,True
Lake Mead National Recreation Area,lake,"AZ,NV",National Recreation Area,35.96622528,-114.3469067,48,38,9,292,True,True,True,True,True
Lake Meredith National Recreation Area,lamr,TX,National Recreation Area,35.61926203,-101.6820066,20,4,0,393,True,True,False,True,True
Lake Roosevelt National Recreation Area,laro,WA,National Recreation Area,48.17148735,-118.3513713,32,16,0,390,True,True,False,False,True
Lassen Volcanic National Park,lavo,CA,National Park,40.49354575,-121.4075993,47,37,11,235,True,True,True,True,True
Lava Beds National Monument,labe,CA,National Monument,41.75915823,-121.5172189,28,30,3,382,True,False,True,True,False
Lewis & Clark National Historic Trail,lecl,"IA,ID,IL,IN,KS,KY,MO,MT,NE,ND,OH,OR,PA,SD,WA,WV",National Historic Trail,41.2646141052,-95.9245147705,14,45,0,381,False,True,True,True,True
Lewis and Clark National Historical Park,lewi,"OR,WA",National Historical Park,46.21178735,-123.9638583,21,19,1,324,False,True,True,False,False
Lincoln Boyhood National Memorial,libo,IN,National Memorial,38.11817004,-86.99656861,18,4,0,281,False,False,True,True,False
Lincoln Home National Historic Site,liho,IL,National Historic Site,39.79715642,-89.64513397,18,17,0,384,False,False,True,False,False
Lincoln Memorial,linc,DC,,38.88927229,-77.05017778,6,9,0,259,False,False,False,False,False
Little Bighorn Battlefield National Monument,libi,MT,National Monument,45.55633048,-107.4183614,9,10,7,399,False,False,False,False,False
Little River Canyon National Preserve,liri,AL,National Preserve,34.41461863,-85.61734327,29,24,2,390,False,True,True,True,False
Little Rock Central High School National Historic Site,chsc,AR,National Historic Site,34.7369465,-92.29987899,6,2,0,387,False,False,False,False,False
Longfellow House Washington's Headquarters National Historic Site,long,MA,National Historic Site,42.37698854,-71.12636956,9,31,0,377,False,False,False,False,False
Lowell National Historical Park,lowe,MA,National Historical Park,42.6455371,-71.31588673,17,14,0,356,False,False,False,False,True
Lower Delaware National Wild and Scenic River,lode,"PA,NJ",National Wild and Scenic River,40.4000389,-74.983737,10,13,0,344,True,True,False,False,True
Lower East Side Tenement Museum National Historic Site,loea,NY,National Historic Site,40.7187683,-73.99001245,8,26,2,396,False,False,False,False,False
Lyndon B Johnson National Historical Park,lyjo,TX,National Historical Park,30.2519655,-98.60692433,7,16,0,346,False,False,False,False,False
Maggie L Walker National Historic Site,mawa,VA,National Historic Site,37.54781499,-77.43746979,5,9,0,387,False,False,False,False,False
Maine Acadian Culture,maac,ME,,47.25102114,-68.59447532,4,6,0,392,False,True,False,False,False
Mammoth Cave National Park,maca,KY,National Park,37.19760458,-86.13090198,35,44,0,285,True,True,True,True,True
Manassas National Battlefield Park,mana,VA,National Battlefield Park,38.81710063,-77.5353468,9,9,0,325,False,True,False,False,False
Manhattan Project National Historical Park,mapr,"NM,WA,TN",National Historical Park,35.88096,-106.30214,4,7,0,387,False,False,False,False,False
Manzanar National Historic Site,manz,CA,National Historic Site,36.72559195,-118.1547177,15,31,0,348,False,False,True,True,False
Marsh - Billings - Rockefeller National Historical Park,mabi,VT,National Historical Park,43.63348732,-72.53424638,26,43,0,366,False,False,True,False,False
"Martin Luther King, Jr. Memorial",mlkm,DC,,38.8862276865,-77.0442195534,6,4,0,302,False,False,False,False,False
"Martin Luther King, Jr. National Historical Park",malu,GA,National Historical Park,33.75618241,-84.37256768,6,4,0,395,False,False,False,False,False
Martin Van Buren National Historic Site,mava,NY,National Historic Site,42.36819596,-73.70834257,12,1,0,390,False,False,True,False,False
Mary McLeod Bethune Council House National Historic Site,mamc,DC,National Historic Site,38.90819107,-77.03096742,7,17,0,397,False,False,False,False,False
Medgar and Myrlie Evers Home National Monument,memy,MS,National Monument,32.34096274,-90.21264553,0,6,0,393,False,False,False,False,False
Mesa Verde National Park,meve,CO,National Park,37.23908345,-108.4624032,20,11,6,397,True,False,True,True,False
Mill Springs Battlefield National Monument,misp,KY,National Monument,37.0688158602,-84.7375361304,5,5,0,231,False,False,False,False,False
Minidoka National Historic Site,miin,"ID,WA",National Historic Site,42.678,-114.2465,4,6,0,394,False,False,False,False,False
Minute Man National Historical Park,mima,MA,National Historical Park,42.4562778,-71.30738884,8,16,0,269,False,False,False,False,False
Minuteman Missile National Historic Site,mimi,SD,National Historic Site,43.89558013,-102.0272131,6,8,0,390,False,False,False,False,False
Mississippi National River & Recreation Area,miss,MN,National River & Recreation Area,44.942487,-93.098712,26,14,0,353,False,True,True,True,True
Missouri National Recreational River,mnrr,"SD,NE",National Recreational River,42.7882189,-97.59077822,44,44,0,354,True,True,True,True,True
Mojave National Preserve,moja,CA,National Preserve,35.12485941,-115.5168258,32,37,0,388,True,False,True,True,False
Monocacy National Battlefield,mono,MD,National Battlefield,39.36084236,-77.39637677,18,18,0,387,False,False,False,False,False
Montezuma Castle National Monument,moca,AZ,National Monument,34.62237771,-111.8147857,14,14,1,301,True,False,True,False,False
Moores Creek National Battlefield,mocr,NC,National Battlefield,34.45820776,-78.11031134,14,31,0,384,False,True,False,False,False
Mormon Pioneer National Historic Trail,mopi,"IL,IA,NE,UT,WY",National Historic Trail,41.2650321741,-101.84083756,9,14,0,188,False,False,False,False,False
Morristown National Historical Park,morr,NJ,National Historical Park,40.7650755,-74.53455122,20,9,0,385,False,False,True,True,False
Mount Rainier National Park,mora,WA,National Park,46.86075416,-121.7043885,36,47,7,399,True,True,True,True,False
Mount Rushmore National Memorial,moru,SD,National Memorial,43.88037021,-103.4525186,10,9,0,398,False,False,False,False,False
Muir Woods National Monument,muwo,CA,National Monument,37.89658027,-122.5808047,9,9,1,343,False,False,True,False,False
Natchez National Historical Park,natc,MS,National Historical Park,31.54697621,-91.39040665,7,5,0,201,False,False,False,False,False
Natchez Trace National Scenic Trail,natt,"AL,MS,TN",National Scenic Trail,34.330290333,-88.7100104094,3,1,0,299,False,False,False,False,False
Natchez Trace Parkway,natr,"AL,MS,TN",Parkway,33.78002293,-89.03092439,29,21,0,388,True,True,True,True,False
National Capital Parks-East,nace,DC,,38.8659,-76.994,1,12,0,379,False,False,False,True,False
National Mall and Memorial Parks,nama,DC,,38.8899,-77.026,18,13,0,387,False,True,True,True,True
National Park of American Samoa,npsa,AS,,-14.22865935,-169.8503777,21,14,0,295,False,False,True,False,False
National Parks of New York Harbor,npnh,NY,,40.6632,-74.0451,37,41,0,389,True,True,True,True,True
Natural Bridges National Monument,nabr,UT,National Monument,37.6045329,-110.0022436,8,6,3,373,True,False,False,False,False
Navajo National Monument,nava,AZ,National Monument,36.71755643,-110.5504015,13,4,0,383,True,False,False,False,False
New Bedford Whaling National Historical Park,nebe,MA,National Historical Park,41.63540552,-70.92322321,3,22,0,398,False,False,False,False,False
New England National Scenic Trail,neen,"MA,CT",National Scenic Trail,42.2915819137,-72.5242767334,8,8,0,396,True,False,False,False,False
New Jersey Pinelands National Reserve,pine,NJ,National Reserve,39.9384,-74.625,0,0,0,387,False,False,False,False,False
New Orleans Jazz National Historical Park,jazz,LA,National Historical Park,29.96303129,-90.06749669,9,4,0,397,False,False,False,False,False
New Philadelphia National Historic Site,neph,IL,National Historic Site,39.69803,-90.96131,1,8,0,373,False,False,False,False,False
New River Gorge National Park & Preserve,neri,WV,National Park & Preserve,37.86878554,-80.99956002,46,36,0,300,True,True,True,True,True
Nez Perce National Historical Park,nepe,"ID,MT,OR,WA",National Historical Park,46.07019093,-115.8761258,18,34,0,399,False,False,True,False,False
Nicodemus National Historic Site,nico,KS,National Historic Site,39.39167606,-99.61680329,5,2,0,347,False,False,False,False,False
Ninety Six National Historic Site,nisi,SC,National Historic Site,34.14273587,-82.01636079,23,11,0,304,False,True,True,False,True
Niobrara National Scenic River,niob,NE,National Scenic River,42.79413083,-99.91870646,21,22,0,383,True,True,True,True,False
Noatak National Preserve,noat,AK,National Preserve,68.01027053,-159.831694,19,9,0,365,True,True,True,False,True
North Cascades National Park,noca,WA,National Park,48.71171756,-121.2069423,30,12,0,375,True,True,False,True,True
North Country National Scenic Trail,noco,"MI,MN,ND,NY,OH,PA,VT,WI",National Scenic Trail,46.334400743,-90.8165630499,18,38,0,377,True,False,True,True,False
Obed Wild & Scenic River,obed,TN,Wild & Scenic River,36.1056026037,-84.5979170501,15,9,0,388,True,True,True,False,False
Ocmulgee Mounds National Historical Park,ocmu,GA,National Historical Park,32.83816576,-83.60224853,14,14,0,398,False,True,True,True,False
Oklahoma City National Memorial,okci,OK,National Memorial,35.473,-97.5171,3,3,1,321,False,False,False,False,False
Old Spanish National Historic Trail,olsp,"AZ,CA,CO,NV,NM,UT",National Historic Trail,37.0791782514,-112.114693431,6,10,0,280,False,False,False,False,False
Olympic National Park,olym,WA,National Park,47.80392754,-123.6663848,54,42,6,387,True,True,True,True,True
Oregon Caves National Monument & Preserve,orca,OR,National Monument & Preserve,42.10319143,-123.4018586,25,2,3,298,True,False,True,False,False
Oregon National Historic Trail,oreg,"ID,KS,MO,NE,OR,WA,WY",National Historic Trail,41.9876977831,-109.634200841,9,13,0,357,False,False,False,False,False
Organ Pipe Cactus National Monument,orpi,AZ,National Monument,32.03585543,-112.8573314,29,21,3,393,True,False,True,True,False
Overmountain Victory National Historic Trail,ovvi,"NC,SC,TN,VA",National Historic Trail,35.14044,-81.377,19,8,0,395,False,False,True,True,False
Oxon Cove Park & Oxon Hill Farm,oxhi,MD,,38.80578214,-77.01131457,13,12,0,332,False,False,True,True,False
Ozark National Scenic Riverways,ozar,MO,National Scenic Riverways,37.13968894,-91.25709817,42,43,0,395,True,True,True,False,True
Padre Island National Seashore,pais,TX,National Seashore,27.05381186,-97.35901135,25,13,8,394,True,True,True,True,True
Palo Alto Battlefield National Historical Park,paal,TX,National Historical Park,26.02387351,-97.46296072,18,37,0,329,False,False,True,True,False
Paterson Great Falls National Historical Park,pagr,NJ,National Historical Park,40.91584645,-74.18021494,6,1,0,397,False,False,False,False,False
Pea Ridge National Military Park,peri,AR,National Military Park,36.45438033,-94.03468357,17,8,0,313,False,False,True,True,False
Pearl Harbor National Memorial,valr,HI,National Memorial,21.3670699388,-157.938578898,7,16,0,328,False,False,False,False,False
Pecos National Historical Park,peco,NM,National Historical Park,35.54192238,-105.6814684,14,36,0,399,False,True,False,False,False
Pennsylvania Avenue,paav,DC,,38.89426856,-77.02506554,2,2,0,183,False,False,False,False,False
Perry's Victory & International Peace Memorial,pevi,OH,Memorial,41.65449782,-82.8115794,22,36,1,353,False,True,True,True,True
Petersburg National Battlefield,pete,VA,National Battlefield,37.19109957,-77.47594865,17,9,0,335,False,True,False,True,False
Petrified Forest National Park,pefo,AZ,National Park,34.98387664,-109.7877678,37,45,9,395,True,False,True,True,False
Petroglyph National Monument,petr,NM,National Monument,35.13915998,-106.7491456,8,3,0,399,False,False,True,False,False
Pictured Rocks National Lakeshore,piro,MI,National Lakeshore,46.56435642,-86.31628733,51,38,8,358,True,True,True,True,True
Pinnacles National Park,pinn,CA,National Park,36.49029208,-121.1813607,26,80,9,343,True,False,True,True,False
Pipe Spring National Monument,pisp,AZ,National Monument,36.86282666,-112.7398567,20,27,1,365,True,False,False,False,False
Pipestone National Monument,pipe,MN,National Monument,44.01351958,-96.32475523,15,14,0,206,False,False,True,False,False
Piscataway Park,pisc,MD,Park,38.6929,-77.067,2,9,0,335,False,True,False,False,True
Point Reyes National Seashore,pore,CA,National Seashore,38.05511241,-122.8797804,18,34,0,398,True,True,True,True,False
Pony Express National Historic Trail,poex,"CA,CO,KS,MO,NE,NV,UT,WY",National Historic Trail,42.2365761128,-109.266148417,11,8,0,309,False,False,False,False,False
Port Chicago Naval Magazine National Memorial,poch,CA,National Memorial,38.05685472,-122.0301603,2,9,0,395,False,False,False,False,False
Potomac Heritage National Scenic Trail,pohe,"DC,MD,PA,VA",National Scenic Trail,39.15060133,-77.52301085,6,17,0,180,True,False,True,True,False
Poverty Point National Monument,popo,LA,National Monument,32.6424361,-91.40829834,4,2,0,390,False,False,False,False,False
President William Jefferson Clinton Birthplace Home National Historic Site,wicl,AR,National Historic Site,33.66758356,-93.59641868,8,6,0,396,False,False,False,False,False
Presidio of San Francisco,prsf,CA,,37.797,-122.4671,10,38,0,391,False,False,True,True,False
Prince William Forest Park,prwi,VA,Park,38.58589108,-77.38910997,29,24,3,392,True,True,True,True,False
Pullman National Historical Park,pull,IL,National Historical Park,41.69429163,-87.60873824,7,14,0,293,False,False,False,False,False
Puʻuhonua o Hōnaunau National Historical Park,puho,HI,National Historical Park,19.41268627,-155.9008789,15,23,6,379,False,True,True,False,False
Puʻukoholā Heiau National Historic Site,puhe,HI,National Historic Site,20.02772186,-155.8211629,13,23,0,399,True,True,True,False,False
Rainbow Bridge National Monument,rabr,UT,National Monument,37.0779,-110.9655,6,7,0,380,False,False,False,False,True
Reconstruction Era National Historical Park,reer,SC,National Historical Park,32.3868598938,-80.6511077881,6,5,0,399,False,False,False,False,False
Redwood National and State Parks,redw,CA,National and State Parks,41.37237268,-124.0318129,39,43,0,362,True,True,True,True,False
Richmond National Battlefield Park,rich,VA,National Battlefield Park,37.48774472,-77.29107785,11,23,0,273,False,False,False,False,False
Rio Grande Wild & Scenic River,rigr,TX,Wild & Scenic River,29.881,-102.3188,15,8,1,343,True,True,True,False,True
River Raisin National Battlefield Park,rira,MI,National Battlefield Park,41.91291085,-83.37620464,40,49,0,395,False,True,True,True,False
Rock Creek Park,rocr,DC,Park,38.95125063,-77.05002838,27,28,0,384,False,True,True,True,False
Rocky Mountain National Park,romo,CO,National Park,40.3556924,-105.6972879,22,19,7,363,True,True,True,False,False
Roger Williams National Memorial,rowi,RI,National Memorial,41.8298955,-71.41056665,12,10,0,396,False,False,False,False,False
Roosevelt Campobello International Park,roca,ME,International Park,44.8736,-66.9621,1,1,0,397,False,False,False,False,False
Rosie the Riveter WWII Home Front National Historical Park,rori,CA,National Historical Park,37.90999027,-122.360156,7,21,0,277,False,False,False,False,False
Russell Cave National Monument,ruca,AL,National Monument,34.97402063,-85.81560314,11,3,0,393,False,False,True,False,False
Sagamore Hill National Historic Site,sahi,NY,National Historic Site,40.88579128,-73.49686438,26,25,0,373,False,False,True,True,False
Saguaro National Park,sagu,AZ,National Park,32.20909636,-110.7574974,14,12,3,394,True,False,False,True,False
Saint Croix Island International Historic Site,sacr,ME,International Historic Site,45.12858838,-67.13363651,3,5,0,394,False,False,True,False,False
Saint Croix National Scenic Riverway,sacn,"WI,MN",National Scenic Riverway,45.70019235,-92.36126685,21,6,0,349,True,True,True,False,True
Saint Paul's Church National Historic Site,sapa,NY,National Historic Site,40.89283511,-73.82577276,9,23,0,397,False,False,False,False,False
Saint-Gaudens National Historical Park,saga,NH,National Historical Park,43.4997238,-72.37333969,27,35,1,379,False,False,True,False,False
Salem Maritime National Historical Park,sama,MA,National Historical Park,42.52024529,-70.88640867,9,23,0,398,False,False,False,False,False
Salinas Pueblo Missions National Monument,sapu,NM,National Monument,34.35423203,-106.2050309,15,38,0,398,False,False,True,False,False
Salt River Bay National Historical Park and Ecological Preserve,sari,VI,National Historical Park and Ecological Preserve,17.77908602,-64.75519348,7,2,0,267,False,False,False,False,False
San Antonio Missions National Historical Park,saan,TX,National Historical Park,29.31262089,-98.4289522,15,17,0,385,False,False,True,True,False
San Francisco Maritime National Historical Park,safr,CA,National Historical Park,37.81005871,-122.4244415,19,15,0,378,False,False,False,False,True
San Juan Island National Historical Park,sajh,WA,National Historical Park,48.51241933,-123.0610277,24,29,0,353,False,False,True,True,False
San Juan National Historic Site,saju,PR,National Historic Site,18.46873857,-66.11848623,10,17,1,393,False,False,True,False,False
Sand Creek Massacre National Historic Site,sand,CO,National Historic Site,38.56414189,-102.5169542,6,14,0,384,False,False,True,False,False
Santa Fe National Historic Trail,safe,"CO,KS,MO,NM,OK",National Historic Trail,37.7276522226,-99.921969227,9,20,0,337,False,False,False,False,False
Santa Monica Mountains National Recreation Area,samo,CA,National Recreation Area,34.09777606,-118.7708619,15,14,0,299,True,False,False,True,False
Saratoga National Historical Park,sara,NY,National Historical Park,42.99522612,-73.63386108,31,52,0,394,False,False,True,True,False
Saugus Iron Works National Historic Site,sair,MA,National Historic Site,42.46830664,-71.0076953,6,11,0,351,False,False,False,False,False
Scotts Bluff National Monument,scbl,NE,National Monument,41.83464193,-103.7071351,18,19,0,365,False,False,False,True,False
Selma To Montgomery National Historic Trail,semo,AL,National Historic Trail,32.27082092,-86.72823702,9,6,0,395,False,False,False,False,False
